{
  "entries": [
    {"capability_id":"EXECUTION","classification":"FORBIDDEN","contract_ref":"ExecutionEventV1","enabled_by_lot":0,"gate_ref":"NO_GATE","implementation_status":"FORBIDDEN_BY_LOT37","owner":"OrderExecutionDomain","schema_version":"lot37-capability-matrix-entry-v1","title":"Execution"},
    {"capability_id":"EXTERNAL_NETWORK_ACCESS","classification":"FORBIDDEN","contract_ref":"NONE","enabled_by_lot":0,"gate_ref":"NO_GATE","implementation_status":"FORBIDDEN_BY_LOT37","owner":"SafetyKernel","schema_version":"lot37-capability-matrix-entry-v1","title":"External Network Access"},
    {"capability_id":"LOT38_ORDER_BOOK_L2_SNAPSHOT_ENGINE","classification":"DISABLED","contract_ref":"OrderBookL2SnapshotEngineStateV1","enabled_by_lot":38,"gate_ref":"LOT38","implementation_status":"PLANNED_LOCKED","owner":"MicrostructureDomain","schema_version":"lot37-capability-matrix-entry-v1","title":"Order Book L2 Snapshot Engine"},
    {"capability_id":"LOT39_ORDER_BOOK_DELTA_SEQUENCE_RECONSTRUCTOR","classification":"DISABLED","contract_ref":"OrderBookDeltaSequenceReconstructorStateV1","enabled_by_lot":39,"gate_ref":"LOT39","implementation_status":"PLANNED_LOCKED","owner":"MicrostructureDomain","schema_version":"lot37-capability-matrix-entry-v1","title":"Order Book Delta & Sequence Reconstructor"},
    {"capability_id":"LOT40_BOOK_INTEGRITY_DESYNCHRONIZATION_DETECTOR","classification":"DISABLED","contract_ref":"BookIntegrityDesynchronizationDetectorStateV1","enabled_by_lot":40,"gate_ref":"LOT40","implementation_status":"PLANNED_LOCKED","owner":"MicrostructureDomain","schema_version":"lot37-capability-matrix-entry-v1","title":"Book Integrity / Desynchronization Detector"},
    {"capability_id":"LOT41_SPREAD_DEPTH_IMBALANCE_ENGINE","classification":"DISABLED","contract_ref":"SpreadDepthImbalanceEngineStateV1","enabled_by_lot":41,"gate_ref":"LOT41","implementation_status":"PLANNED_LOCKED","owner":"MicrostructureDomain","schema_version":"lot37-capability-matrix-entry-v1","title":"Spread, Depth & Imbalance Engine"},
    {"capability_id":"LOT42_LIQUIDITY_ZONES_WALLS_VOIDS_ENGINE","classification":"DISABLED","contract_ref":"LiquidityZonesWallsVoidsEngineStateV1","enabled_by_lot":42,"gate_ref":"LOT42","implementation_status":"PLANNED_LOCKED","owner":"MicrostructureDomain","schema_version":"lot37-capability-matrix-entry-v1","title":"Liquidity Zones, Walls & Voids Engine"},
    {"capability_id":"LOT43_BOOK_RESILIENCE_REPLENISHMENT_ENGINE","classification":"DISABLED","contract_ref":"BookResilienceReplenishmentEngineStateV1","enabled_by_lot":43,"gate_ref":"LOT43","implementation_status":"PLANNED_LOCKED","owner":"MicrostructureDomain","schema_version":"lot37-capability-matrix-entry-v1","title":"Book Resilience & Replenishment Engine"},
    {"capability_id":"LOT44_TRADES_AGGRESSOR_CLASSIFICATION_SCHEMA","classification":"DISABLED","contract_ref":"TradesAggressorClassificationSchemaStateV1","enabled_by_lot":44,"gate_ref":"LOT44","implementation_status":"PLANNED_LOCKED","owner":"MicrostructureDomain","schema_version":"lot37-capability-matrix-entry-v1","title":"Trades & Aggressor Classification Schema"},
    {"capability_id":"LOT45_ORDER_FLOW_DELTA_CVD_ENGINE","classification":"DISABLED","contract_ref":"OrderFlowDeltaCVDEngineStateV1","enabled_by_lot":45,"gate_ref":"LOT45","implementation_status":"PLANNED_LOCKED","owner":"MicrostructureDomain","schema_version":"lot37-capability-matrix-entry-v1","title":"Order Flow, Delta & CVD Engine"},
    {"capability_id":"LOT46_TRADE_CLASSIFICATION_CONFIDENCE_ENGINE","classification":"DISABLED","contract_ref":"TradeClassificationConfidenceEngineStateV1","enabled_by_lot":46,"gate_ref":"LOT46","implementation_status":"PLANNED_LOCKED","owner":"MicrostructureDomain","schema_version":"lot37-capability-matrix-entry-v1","title":"Trade Classification Confidence Engine"},
    {"capability_id":"LOT47_ABSORPTION_DEFENSE_HIDDEN_LIQUIDITY_PROXY","classification":"DISABLED","contract_ref":"AbsorptionDefenseHiddenLiquidityProxyStateV1","enabled_by_lot":47,"gate_ref":"LOT47","implementation_status":"PLANNED_LOCKED","owner":"MicrostructureDomain","schema_version":"lot37-capability-matrix-entry-v1","title":"Absorption, Defense & Hidden Liquidity Proxy"},
    {"capability_id":"LOT48_VOLUME_CLUSTERS_TIME_AT_LEVEL_ENGINE","classification":"DISABLED","contract_ref":"VolumeClustersTimeAtLevelEngineStateV1","enabled_by_lot":48,"gate_ref":"LOT48","implementation_status":"PLANNED_LOCKED","owner":"MicrostructureDomain","schema_version":"lot37-capability-matrix-entry-v1","title":"Volume Clusters & Time-at-Level Engine"},
    {"capability_id":"LOT49_STOP_ZONES_LIQUIDITY_POOLS_BREAKOUT_ATTRACTION","classification":"DISABLED","contract_ref":"StopZonesLiquidityPoolsBreakoutAttractionStateV1","enabled_by_lot":49,"gate_ref":"LOT49","implementation_status":"PLANNED_LOCKED","owner":"MicrostructureDomain","schema_version":"lot37-capability-matrix-entry-v1","title":"Stop Zones, Liquidity Pools & Breakout Attraction"},
    {"capability_id":"LOT50_SWEEP_FAKEOUT_TRAP_FAILED_AUCTION_ENGINE","classification":"DISABLED","contract_ref":"SweepFakeoutTrapFailedAuctionEngineStateV1","enabled_by_lot":50,"gate_ref":"LOT50","implementation_status":"PLANNED_LOCKED","owner":"MicrostructureDomain","schema_version":"lot37-capability-matrix-entry-v1","title":"Sweep, Fakeout, Trap & Failed Auction Engine"},
    {"capability_id":"LOT51_DERIVATIVES_CONTEXT","classification":"DISABLED","contract_ref":"DerivativesContextOIFundingBasisLiquidationsStateV1","enabled_by_lot":51,"gate_ref":"LOT51","implementation_status":"PLANNED_LOCKED","owner":"MicrostructureDomain","schema_version":"lot37-capability-matrix-entry-v1","title":"Derivatives Context: OI, Funding, Basis & Liquidations"},
    {"capability_id":"LOT52_GAME_THEORY_SCENARIO_AGGREGATION_V4_CLOSURE","classification":"DISABLED","contract_ref":"GameTheoryScenarioAggregationV4ClosureStateV1","enabled_by_lot":52,"gate_ref":"LOT52","implementation_status":"PLANNED_LOCKED","owner":"MicrostructureDomain","schema_version":"lot37-capability-matrix-entry-v1","title":"Game Theory, Scenario Aggregation & V4 Closure"},
    {"capability_id":"OFFLINE_DATA_CONTRACT_REGISTRY","classification":"REQUIRED","contract_ref":"MicrostructureScopeOfflineDataContractsContractRegistryV1","enabled_by_lot":37,"gate_ref":"LOT37","implementation_status":"ACTIVE_LOT37_SCOPE","owner":"MicrostructureDomain","schema_version":"lot37-capability-matrix-entry-v1","title":"Offline Data Contract Registry"},
    {"capability_id":"ORDER_ROUTING","classification":"FORBIDDEN","contract_ref":"OrderIntentV1","enabled_by_lot":0,"gate_ref":"NO_GATE","implementation_status":"FORBIDDEN_BY_LOT37","owner":"OrderExecutionDomain","schema_version":"lot37-capability-matrix-entry-v1","title":"Order Routing"},
    {"capability_id":"PARTICIPANT_INTENT_AS_FACT","classification":"FORBIDDEN","contract_ref":"NONE","enabled_by_lot":0,"gate_ref":"NO_GATE","implementation_status":"FORBIDDEN_BY_V4_BOUNDARY","owner":"MicrostructureDomain","schema_version":"lot37-capability-matrix-entry-v1","title":"Participant Intent Presented as Fact"},
    {"capability_id":"PUBLIC_API_BOUNDARY","classification":"REQUIRED","contract_ref":"MicrostructureScopeOfflineDataContractsStateV1","enabled_by_lot":37,"gate_ref":"LOT37","implementation_status":"ACTIVE_LOT37_SCOPE","owner":"MicrostructureDomain","schema_version":"lot37-capability-matrix-entry-v1","title":"Microstructure Public API Boundary"},
    {"capability_id":"RISK_APPROVAL","classification":"FORBIDDEN","contract_ref":"RiskDecisionV1","enabled_by_lot":0,"gate_ref":"NO_GATE","implementation_status":"FORBIDDEN_BY_LOT37","owner":"RiskDomain","schema_version":"lot37-capability-matrix-entry-v1","title":"Risk Approval"},
    {"capability_id":"SCENARIO_SCORE_AS_SIGNAL","classification":"FORBIDDEN","contract_ref":"NONE","enabled_by_lot":0,"gate_ref":"NO_GATE","implementation_status":"FORBIDDEN_BY_V4_BOUNDARY","owner":"SafetyKernel","schema_version":"lot37-capability-matrix-entry-v1","title":"Scenario Score Converted to Signal"},
    {"capability_id":"SIGNAL_GENERATION","classification":"FORBIDDEN","contract_ref":"SignalV1","enabled_by_lot":0,"gate_ref":"NO_GATE","implementation_status":"FORBIDDEN_BY_LOT37","owner":"StrategyResearchDomain","schema_version":"lot37-capability-matrix-entry-v1","title":"Signal Generation"},
    {"capability_id":"TRADING","classification":"FORBIDDEN","contract_ref":"NONE","enabled_by_lot":0,"gate_ref":"NO_GATE","implementation_status":"FORBIDDEN_BY_LOT37","owner":"LiveGovernanceDomain","schema_version":"lot37-capability-matrix-entry-v1","title":"Trading"},
    {"capability_id":"V4_CAPABILITY_MATRIX","classification":"REQUIRED","contract_ref":"MicrostructureScopeOfflineDataContractsCapabilityMatrixV1","enabled_by_lot":37,"gate_ref":"LOT37","implementation_status":"ACTIVE_LOT37_SCOPE","owner":"MicrostructureDomain","schema_version":"lot37-capability-matrix-entry-v1","title":"V4 Capability Matrix"},
    {"capability_id":"V4_SCOPE_BOUNDARY","classification":"REQUIRED","contract_ref":"MicrostructureScopeOfflineDataContractsStateV1","enabled_by_lot":37,"gate_ref":"LOT37","implementation_status":"ACTIVE_LOT37_SCOPE","owner":"MicrostructureDomain","schema_version":"lot37-capability-matrix-entry-v1","title":"V4 Scope and Domain Boundary"}
  ],
  "matrix_id": "v4-microstructure-capability-matrix-v1",
  "matrix_version": "1.0.0",
  "schema_version": "microstructure-scope-offline-data-contracts-capability-matrix-v1"
}
